{
  "schema_version": "1.0",
  "run_id": "fixture-manifest-valid-hash",
  "task_id": "TASK-20260715__bootstrap_reproducible_baseline",
  "claim_ids": [],
  "classification": "EMPIRICAL_OBSERVATION",
  "target_statement": "Engineering-only manifest integrity fixture",
  "project_commit": null,
  "working_tree_status": "not-a-git-repository",
  "upstream_repository": "https://github.com/rbsandeep/Erdos-Gyarfas",
  "upstream_commit": null,
  "executable_sha256": null,
  "command": [],
  "parameters": {},
  "search_mode": "scaffold-only",
  "k": null,
  "forbidden_cycle_lengths": [],
  "pruning_rule_ids": [],
  "partition_id": null,
  "seed": null,
  "started_at_utc": null,
  "finished_at_utc": null,
  "exit_code": null,
  "termination_reason": "not-run",
  "completed": false,
  "host": null,
  "operating_system": null,
  "architecture": null,
  "compiler": null,
  "compiler_flags": [],
  "runtime_dependencies": {},
  "environment": {},
  "cpu_count": null,
  "memory_limit_bytes": null,
  "peak_memory_bytes": null,
  "wall_time_seconds": null,
  "cpu_time_seconds": null,
  "counters": {},
  "artifacts": ["tests/fixtures/manifest-hash-target.txt"],
  "artifact_sha256": {
    "tests/fixtures/manifest-hash-target.txt": "fe444d0d8bbde9d2b3b7828bf7ec74aaafd9039a991ff3055d743a26f8e9800b"
  },
  "stdout_sha256": null,
  "stderr_sha256": null,
  "verifier": null,
  "verifier_result": "not-run",
  "limitations": [
    "Fixture validates syntax and one artifact hash only; it is not a run."
  ]
}
