{
  "schema_version": "1.0",
  "run_id": "replace-with-stable-run-id",
  "task_id": "TASK-00000000__template",
  "claim_ids": [],
  "classification": "ENGINEERING_ASSUMPTION",
  "target_statement": "Unexecuted manifest template; no computation occurred.",
  "project_commit": null,
  "working_tree_status": "unknown",
  "upstream_repository": "https://github.com/rbsandeep/Erdos-Gyarfas",
  "upstream_commit": null,
  "executable_sha256": null,
  "command": [],
  "parameters": {},
  "search_mode": "scaffold-only",
  "k": null,
  "forbidden_cycle_lengths": [],
  "pruning_rule_ids": [],
  "partition_id": null,
  "seed": null,
  "started_at_utc": null,
  "finished_at_utc": null,
  "exit_code": null,
  "termination_reason": "not-run",
  "completed": false,
  "host": null,
  "operating_system": null,
  "architecture": null,
  "compiler": null,
  "compiler_flags": [],
  "runtime_dependencies": {},
  "environment": {},
  "cpu_count": null,
  "memory_limit_bytes": null,
  "peak_memory_bytes": null,
  "wall_time_seconds": null,
  "cpu_time_seconds": null,
  "counters": {},
  "artifacts": [],
  "artifact_sha256": {},
  "stdout_sha256": null,
  "stderr_sha256": null,
  "verifier": null,
  "verifier_result": "not-run",
  "limitations": [
    "Template only; this is not evidence that a run occurred.",
    "No search, partition, certificate, or mathematical verification is represented."
  ]
}
